Name,Organisation,Category,Location,Email,Alternative Contact,Status,Notes
Famiglia Leone de Castris,Leone de Castris,Patron,Salice Salentino (LE),info@leonedecastris.com,https://www.leonedecastris.com/eng/contacts/,Not Contacted,Historic winery family est. 1665; email verified on official site
Famiglia Cantele,Cantele,Patron,Guagnano (LE),cantele@cantele.it,https://www.cantele.it/en/contact-us/,Not Contacted,Family winery run by four siblings since 1979; email verified on official site
CNH Industrial - Stabilimento Lecce,CNH Industrial,Corporate Patron,Lecce,,https://www.cnh.com/it-it/pages/contact-us.aspx,Not Contacted,Largest EMEA earth-moving-machinery production site; major Salento employer; no plant-level email published
Leo Shoes,Leo Shoes Srl,Corporate Patron,Casarano (LE),,http://www.leoshoes.it/contatti,Not Contacted,Major footwear manufacturer around 800 employees part of the Sneakers Valley district; no email published
Fersalento,Fersalento S.r.l.,Corporate Patron,Lecce,info@fersalento.com,https://www.fersalento.com/contatti/,Not Contacted,Railway construction and maintenance firm of national relevance; email verified on official site
Cantine Due Palme,Cantine Due Palme,Corporate Patron,Cellino San Marco (BR),info@cantineduepalme.it,https://cantineduepalme.wine/it/lazienda/info-contatti.html,Not Contacted,Large cooperative winery and major Salento-area agribusiness employer; email appears in third-party listings moderate confidence
COG,COG (Colucci G. e G. Srl),Corporate Patron,Lecce,,https://cog.it/,Not Contacted,Leading manufacturer of radiators and heat exchangers for industrial vehicles; no email published
Barbetta,Barbetta (Gruppo Florence),Corporate Patron,Nardò (LE),,https://barbetta.gruppoflorence.it/en/contacts/,Not Contacted,Family jersey-manufacturing business founded 1973 acquired by Gruppo Florence in 2022; email obfuscated on official site
Distilleria De Giorgi,Distilleria De Giorgi,Corporate Patron,San Cesario di Lecce (LE),,https://www.distilleriadegiorgi.eu/,Not Contacted,Historic family-run distillery dating to the early 1900s; no verifiable official email found
Fondazione Terra d'Otranto,Fondazione Terra d'Otranto,Strategic Partner,Nardò (LE),fondazionetdo@gmail.com,https://www.fondazioneterradotranto.it/contattaci/,Not Contacted,Cultural and historical heritage foundation for the Terra d'Otranto territory founded 2011
Fondazione di Comunità del Salento,Fondazione di Comunità del Salento ETS,Strategic Partner,Lecce,fondazionesalento@gmail.com,https://www.fondazionesalento.it/,Not Contacted,Community philanthropy foundation covering Lecce Brindisi and Taranto provinces
WWF Salento,WWF Salento (delegazione WWF Italia),Strategic Partner,Lecce,lecce@wwf.it,http://www.wwfsalento.it/contatti.htm,Not Contacted,Local WWF delegation active since 1973 relevant to coastal dune and macchia conservation
Legambiente Lecce,Legambiente Lecce (circolo territoriale),Strategic Partner,Lecce,legambiente.lecce@tiscali.it,http://legambientelecce.blogspot.com/p/contatti.html,Not Contacted,Local Legambiente chapter active on wildfire prevention and territorial environment advocacy
Consorzio Parco Otranto-Leuca,Consorzio di Gestione del Parco Naturale Regionale Costa Otranto - Santa Maria di Leuca e Bosco di Tricase,Strategic Partner,Andrano (LE),info@parcootrantoleuca.it,https://www.parcootrantoleuca.it/,Not Contacted,Statutory management consortium for the Otranto-Leuca coastal park directly relevant to wildfire-prevention territory
Ordine Architetti Lecce,Ordine degli Architetti P.P.C. della Provincia di Lecce,Introducer,Lecce,architetti@lecce.archiworld.it,https://www.architettilecce.it,Not Contacted,Provincial order relevant to territorial and landscape governance
Ordine Ingegneri Lecce,Ordine degli Ingegneri della Provincia di Lecce,Introducer,Lecce,info@ordineingegnerilecce.it,https://www.ordineingegnerilecce.it/contatti/,Not Contacted,Email and PEC confirmed on the order's own contact page
Ordine Agronomi e Forestali Lecce,Ordine dei Dottori Agronomi e dei Dottori Forestali della Provincia di Lecce,Introducer,Lecce,ordinelecce@conaf.it,https://ordinelecce.conaf.it/,Not Contacted,Directly relevant given Xylella and land-management focus
Università del Salento,Università del Salento,Introducer,Lecce,urp@unisalento.it,https://www.unisalento.it/ufficio-comunicazione-istituzionale,Not Contacted,General public relations and institutional contact point for the university
Edoardo Winspeare,Independent filmmaker,Public Figure Patron,Tricase (LE),,https://www.imdb.com/name/nm0935529/,Not Contacted,Film director resident in Salento known for Salento-themed films; no verified official contact channel found low confidence
Sud Sound System,Salento Sound System S.r.l.,Public Figure Patron,San Donato di Lecce (LE),info@sudsoundsystem.it,https://sudsoundsystem.it/contatti/,Not Contacted,Iconic Salento reggae and dancehall collective promoting local dialect and identity
Boomdabash,Boomdabash,Public Figure Patron,Mesagne (BR),,https://www.boomdabash.com/,Not Contacted,Salento-Brindisi area dancehall-pop band with strong regional identity; management contact info@soulmatical.com given as alternative
Emma Marrone,Independent artist,Public Figure Patron,Aradeo (LE),,https://www.emmamarrone.net/,Not Contacted,Singer raised in Aradeo Salento who publicly expresses attachment to the territory; no verified direct email found
Al Bano Carrisi,Tenute Al Bano,Public Figure Patron,Cellino San Marco (BR) - Terra d'Otranto,groups@tenutealbano.com,https://www.tenutealbano.com/contatti/,Not Contacted,Cellino San Marco is in Brindisi province historically part of Terra d'Otranto; email is for his estate business not a confirmed personal address
Camera di Commercio di Lecce,Camera di Commercio di Lecce,Chamber of Commerce,Lecce,cameradicommercio@le.camcom.it,https://www.le.camcom.it/,Not Contacted,Official standalone Chamber for Lecce province
Camera di Commercio di Brindisi-Taranto,Camera di Commercio di Brindisi-Taranto,Chamber of Commerce,Brindisi / Taranto,cameradicommercio@pec.brta.camcom.it,https://www.brta.camcom.it/,Not Contacted,Merged 2021 body covering the adjacent Brindisi area of Salento; only a PEC address published
Confindustria Lecce,Confindustria Lecce,Confindustria,Lecce,segreteria@confindustrialecce.it,https://www.confindustrialecce.it/contatti/,Not Contacted,Territorial industrialists association for Lecce province
Confindustria Brindisi,Confindustria Brindisi,Confindustria,Brindisi,confind@confindustriabrindisi.it,https://www.confindustriabrindisi.it/contact-us/,Not Contacted,Adjacent territorial association covering Brindisi province
Fondazione Palmieri,Fondazione Palmieri Onlus,Foundation,Lecce,info@fondazionepalmieri.it,https://fondazionepalmieri.it/contatti/,Not Contacted,Arts and culture foundation based at Chiesa di San Sebastiano
Fondazione Le Costantine,Fondazione Le Costantine ETS,Foundation,Uggiano La Chiesa (LE),info@lecostantine.eu,https://www.lecostantine.it/contatti/,Not Contacted,Historic women's craft and social foundation covering weaving biodynamic agriculture and education
Fondazione BPP,Fondazione Banca Popolare Pugliese Giorgio Primiceri ETS,Foundation,Parabita (LE),funzione.segreteria.generale@bpp.it,https://fondazione.bpp.it/,Not Contacted,Corporate and territorial philanthropy foundation tied to a Salento-rooted bank
Parco Porto Selvaggio,Parco Naturale Regionale di Porto Selvaggio e Palude del Capitano,Environmental Organisation,Nardò (LE),,https://www.portoselvaggio.net/,Not Contacted,Reserve and park management office for a key dune and pinewood macchia site historically wildfire-affected
Fondazione La Notte della Taranta,Fondazione La Notte della Taranta,Cultural Institution,Melpignano (LE),segreteria@lanottedellataranta.it,https://www.lanottedellataranta.it/it/component/k2/item/390-contatti,Not Contacted,Major Salento cultural foundation and festival dedicated to pizzica music heritage
Teatro Apollo e Paisiello,Teatro Apollo e Paisiello (Comune di Lecce),Cultural Institution,Lecce,teatriapolloepaisiello@comune.lecce.it,https://www.comune.lecce.it/aree-tematiche/cultura-e-tempo-libero/servizi-comunali/utilizzo-teatri-paisiello-apollo,Not Contacted,Municipally-run historic theatre in Lecce
Museo Castromediano,Museo Archeologico Provinciale Sigismondo Castromediano,Cultural Institution,Lecce,museocastromediano.lecce@regione.puglia.it,https://www.comune.lecce.it/vivi-lecce/musei-e-gallerie/museo-provinciale-sigismondo-castromediano,Not Contacted,Puglia's oldest public museum regionally managed
Castello Carlo V,Castello Carlo V di Lecce,Cultural Institution,Lecce,cs-ba.castellocarlov@cultura.gov.it,https://museipuglia.cultura.gov.it/musei/castello-carlo-v-di-lecce/,Not Contacted,State-managed historic castle and cultural venue in central Lecce
Hotel Palazzo Papaleo,Hotel Palazzo Papaleo,Luxury Hospitality,Otranto,info@hotelpalazzopapaleo.com,https://www.hotelpalazzopapaleo.com/,Not Contacted,5-star hotel in Otranto historic center
Relais Valle dell'Idro,Relais Valle dell'Idro,Luxury Hospitality,Otranto,info@valledellidro.com,https://www.valledellidro.com/en,Not Contacted,4-star boutique hotel in Otranto
Biancodonda,Biancodonda Greenblu Hotel & Spa,Luxury Hospitality,Gallipoli,booking@greenblu.it,https://biancodonda.com/en/contacts-hotel-gallipoli/,Not Contacted,5-star lifestyle hotel and spa near Gallipoli old town
Hotel Palazzo del Corso,Palazzo del Corso,Luxury Hospitality,Gallipoli,info@hotelpalazzodelcorso.it,https://www.hotelpalazzodelcorso.it/,Not Contacted,5-star boutique hotel on Gallipoli's main street
Augustus Resort,Augustus Resort,Luxury Hospitality,Santa Cesarea Terme,info@augustusresort.it,https://augustusresort.com/contatti/,Not Contacted,Resort at Porto Miggiano
Masseria Torre Maizza,Masseria Torre Maizza (Rocco Forte Hotels),Luxury Hospitality,Savelletri di Fasano (Brindisi - Ostuni area),reservations.torremaizza@roccofortehotels.com,https://www.roccofortehotels.com/hotels-and-resorts/masseria-torre-maizza/,Not Contacted,Well-known luxury masseria-hotel near Ostuni; technically Brindisi province not Lecce but explicitly Ostuni-adjacent
Masseria Montelauro,Masseria Montelauro,Masseria,Otranto,info@masseriamontelauro.it,https://masseriamontelauro.it/en/,Not Contacted,Historic converted masseria hotel near Otranto
Le Pajare,Hotel Masseria Le Pajare,Masseria,Presicce (LE),info@lepajare.com,https://www.lepajare.com/,Not Contacted,Converted masseria and agritourism property; email from search snippet not independently re-fetched
Masseria LuciaGiovanni,Masseria & Spa LuciaGiovanni,Masseria,Lecce,contatti@masserialuciagiovanni.it,https://www.masserialuciagiovanni.it/en/,Not Contacted,4-star masseria resort with spa; email from search snippet not independently re-fetched
Masseria Rifisa,Masseria Rifisa,Masseria,Caprarica di Lecce (LE),,https://www.masseriarifisa.it/en/contact-us/,Not Contacted,Luxury masseria accommodation; email domain spelling inconsistent between sources so left blank pending verification
Naturalis Bio Resort,Naturalis Bio Resort,Masseria,Martano (LE),info@naturalisbioresort.com,https://www.naturalisbioresort.com/en/4-star-bio-resort-in-salento,Not Contacted,4-star bio-resort in a converted rural property near Lecce
Vallone,Agricole Vallone,Wine Producer,Lecce,info@agvallone.it,https://www.vallone.wine/contatti/,Not Contacted,Long-established Lecce winery producing Salento Negroamaro and IGT wines
Apollonio,Apollonio Casa Vinicola,Wine Producer,Monteroni di Lecce (LE),info@apolloniovini.it,https://www.apolloniovini.it/contatti/,Not Contacted,Family winery producing Copertino DOP and Salento IGP wines
GAL Terra d'Otranto,GAL Terra d'Otranto,Tourism Group,Otranto,info@galterradotranto.it,https://www.galterradotranto.it/,Not Contacted,Local Action Group for rural and sustainable tourism development; email from search snippet not independently re-fetched
GAL Isola Salento,GAL Isola Salento,Tourism Group,Martano (LE),info@isolasalento.org,https://www.isolasalento.org/contact/,Not Contacted,Local Action Group covering inland Grecia Salentina Salento towns
Federalberghi Lecce,Federalberghi Lecce,Tourism Group,Lecce,lecce@confcommercio.it,http://www.lecce.federalberghi.it/,Not Contacted,Provincial hoteliers association operating via Confcommercio Lecce; email is the parent Confcommercio address not association-specific
Pugliapromozione,Pugliapromozione (Agenzia Regionale del Turismo),Tourism Group,Lecce,direzione.generale@aret.regione.puglia.it,https://aret.regione.puglia.it/en/contatti,Not Contacted,Regional tourism promotion agency with a dedicated Lecce territorial office
Coldiretti Lecce,Coldiretti Lecce,Agricultural Organisation,Lecce,lecce@coldiretti.it,http://www.lecce.coldiretti.it,Not Contacted,Provincial farmers federation active on Xylella-affected olive land management
Confagricoltura Lecce,Confagricoltura Lecce (Unione Provinciale Agricoltori),Agricultural Organisation,Lecce,lecce@confagricoltura.it,https://www.confagricolturale.it/confagricoltura-lecce-contatti/,Not Contacted,Provincial employers agricultural association
CIA Lecce,CIA - Agricoltori Italiani Salento,Agricultural Organisation,Lecce,lecce@cia.it,https://www.cia.it/dove-siamo/sedi/,Not Contacted,Third major farmers union in the province
Consorzio di Bonifica Ugento e Li Foggi,Consorzio di Bonifica Ugento e Li Foggi,Agricultural Organisation,Ugento (LE),info@bonificaugento.it,https://bonificaugento.bonificacspuglia.it/contatti/,Not Contacted,Land reclamation and water management consortium covering southern Salento
Consorzio di Bonifica Arneo,Consorzio Speciale per la Bonifica di Arneo,Agricultural Organisation,Nardò (LE),,https://consorziobonificadiarneo.bonificacspuglia.it/,Not Contacted,Covers the Nardò and Gallipoli area; only PEC addresses found and body is mid-merger into a larger consortium
Ordine Geologi Puglia,Ordine dei Geologi della Puglia,Professional Association,Bari,info@geologipuglia.it,https://www.geologipuglia.it/segreteria/,Not Contacted,Regional order based in Bari covering Salento; geological and hydrogeological expertise relevant to territorial regeneration
Helen Mirren & Taylor Hackford,Independent (actress and director),Public Figure Patron,Tiggiano (LE),,https://www.helenmirren.com/contactsqa/ (CAA agent Fred Specktor London),Not Contacted,Oscar-winning actress and husband own a restored masseria in Tiggiano since the early 2000s; publicly campaigned to save Salento's olive trees from Xylella
Giuseppe Maria Ricchiuto,Sandemetrio / Gruppo Specchiasol,Philanthropic Individual,Specchia (LE),,https://www.sandemetriosrl.com,Not Contacted,Born in Specchia; founder and president of Gruppo Specchiasol and of Sandemetrio its organic medicinal-herb farm in Specchia; recognised for green entrepreneurship
Ennio Capasa,Costume National,Public Figure Patron,Lecce (born),,https://www.costumenational.com/pages/contact,Not Contacted,Fashion designer born in Lecce founder of internationally known label Costume National; no personal email published brand contact page given
Floriano Pellegrino e Isabella Potì,Pellegrino Brothers,Public Figure Patron,Lecce / Scorrano,info@pellegrinobrothers.it,https://www.pellegrinobrothers.it/contatti,Not Contacted,Michelin-starred chef duo based in Lecce and Scorrano; email verified on official site
Negramaro (Giuliano Sangiorgi),Negramaro,Public Figure Patron,Copertino (LE),,https://www.negramaro.com,Not Contacted,Multi-platinum rock band founded in Copertino; frontman born in Nardò; booking via Magellano Concerti given as alternative
Frantoio Cazzetta 1899,Terra d'Otranto S.r.l.,Olive Oil Producer,Palmariggi (LE),info@oliocazzetta.com,https://oliocazzetta.com/,Not Contacted,Historic olive mill since 1899 sixth generation; inland Salento area affected by Xylella regionally; email verified on official site
Olio Palese,Olio Palese,Olive Oil Producer,Presicce-Acquarica (LE),info@oliopalese.it,https://oliopalese.it/,Not Contacted,Family-run estate around 40 hectares near the epicentre of the 2013 Xylella outbreak; email verified on official site
Terra Pajara,Olio Terra Pajara,Olive Oil Producer,Presicce-Acquarica (LE),giuliamonte80@gmail.com,https://www.terrapajara.it/Azienda.html,Not Contacted,Small family producer explicitly affected by Xylella replanted resistant cultivars; contact is a personal address moderate confidence
Frantoio Santo Eligio,Santo Eligio,Olive Oil Producer,Presicce (LE),,https://www.oliosantoeligio.it/,Not Contacted,Family mill operating since 1960 in the same Xylella-affected area; no public email found only contact form
Castello Monaci,Castello Monaci (Gruppo Italiano Vini),Wine Producer,San Pancrazio Salentino (BR),info@castellomonaci.com,https://www.castellomonaci.com/en/where-we-are/,Not Contacted,Historic estate with on-site wine museum; email verified on official site
Conti Zecca,Azienda Agricola Conti Zecca,Wine Producer,Leverano (LE),info@contizecca.it,https://contizecca.it/contatti/,Not Contacted,Landowning family since 1580 comital title 1884 still family-run estate around 320 hectares; email verified on official site
Masseria Li Veli,Masseria Li Veli (Falvo family),Wine Producer,Cellino San Marco (BR),info@liveli.it,https://www.liveli.it/en/info/,Not Contacted,Boutique family-owned estate; email verified on official site
Schola Sarmenti,Schola Sarmenti,Wine Producer,Nardò (LE),info@scholasarmenti.it,https://www.scholasarmenti.it/,Not Contacted,Boutique winery in the heart of Salento; email verified on official site
Tenute Rubino,Azienda Agricola Dott. Luigi Rubino,Wine Producer,Brindisi (BR),info@tenuterubino.it,https://www.tenuterubino.com/contacts/?lang=en,Not Contacted,Known for the indigenous Susumaniello variety; email domain differs from website domain moderate confidence
Baglioni Masseria Muzza Resort & Spa,Baglioni Hotels,Luxury Hospitality,Otranto,reservations.masseriamuzza@baglionihotels.com,https://puglia.baglionihotels.com/contact,Not Contacted,New luxury masseria resort under Baglioni Hotels group; email corroborated via secondary listings moderate confidence
Masseria Muntibianchi,Masseria Muntibianchi,Luxury Hospitality,Otranto,info@masseriamuntibianchi.it,https://www.masseriamuntibianchi.it,Not Contacted,Boutique agriresort with spa; email verified on official site
Masseria Prosperi,Masseria Prosperi,Luxury Hospitality,Otranto,info@masseriaprosperi.it,https://www.masseriaprosperi.it,Not Contacted,Luxury boutique farm and masseria; email verified on official site
Est Hotel,Est Hotel,Luxury Hospitality,Santa Cesarea Terme,info@esthotel.it,https://www.esthotel.it,Not Contacted,4-star coastal hotel on the Adriatic cliffs; email verified on official site
Marenea Suite Hotel,CDSHotels,Luxury Hospitality,Castro (LE),,https://mareneasuitehotel.com/contact-us/,Not Contacted,5-star coastal suite hotel; only a group-wide CDSHotels address found not property-specific so left blank
Guarini family,Azienda Agraria Duca Carlo Guarini,Historic Family Estate,Scorrano (LE),welcome@ducacarloguarini.it,https://www.ducacarloguarini.it/en/about-us/,Not Contacted,Norman-origin noble family with documented vineyard stewardship since 1114; manages around 700 hectares of vineyards olive groves and masserie
Bacile di Castiglione family,I Tre Bacili,Historic Family Estate,Spongano (LE),info@itrebacili.it,https://www.itrebacili.it/en/about-us.php,Not Contacted,Noble family resident in Terra d'Otranto for centuries; family estate converted to boutique hospitality with explicit land-stewardship focus
Piccinni-Fedele family,Tenuta Monacelli,Major Landowner,Casalabate (LE),booking@tenutamonacelli.com,https://www.tenutamonacelli.com,Not Contacted,Family-managed estate around 330 to 400 hectares including woodland directly relevant to wildfire risk; family name sourced from press not the estate's own site
La Fiermontina Luxury Home,La Fiermontina Collection,Luxury Hospitality,Lecce (historic centre),info@lafiermontina.com,https://www.lafiermontina.com/,Not Contacted,5-star luxury urban resort in Lecce's old town art and design concept; email verified on official site
Patria Palace Hotel,Patria Palace Hotel Lecce,Luxury Hospitality,Lecce (historic centre),info@patriapalace.com,https://patriapalace.com/en/,Not Contacted,5-star hotel adjacent to Lecce Cathedral member of The Leading Hotels of the World; email verified on official site
Risorgimento Resort,Risorgimento Resort Lecce (Vestas Hotels & Resorts),Luxury Hospitality,Lecce (historic centre),info@risorgimentoresort.it,https://www.risorgimentoresort.it/,Not Contacted,5-star design hotel near the Cathedral with rooftop restaurant; email sourced via search reference direct fetch failed on certificate error medium confidence
GH Gallipoli Resort,Garibaldi Hotels,Luxury Hospitality,Gallipoli,gallipoliresort@garibaldihotels.it,https://gallipoliresort.it/,Not Contacted,Beachfront resort just outside Gallipoli's old town; email verified on official site
Grand Hotel Riviera,CDSHotels,Luxury Hospitality,Nardò (Santa Maria al Bagno),,https://cdshotels.it/en/grand-hotel-riviera/,Not Contacted,Seafront hotel part of the CDSHotels group; no verifiable direct email found official page given instead
Relais Masseria Le Cesine,CDSHotels,Luxury Hospitality,Vernole (LE),,https://cdshotels.it/en/relais-masseria-le-cesine-en/,Not Contacted,Restored 17th-century masseria resort near the Le Cesine nature reserve part of CDSHotels group; no verifiable direct email found
Masseria Uccio,Masseria Uccio,Luxury Hospitality,Tricase (LE),info@masseriauccio.com,https://www.masseriauccio.com/,Not Contacted,Boutique stone masseria inside the Otranto-Santa Maria di Leuca-Bosco di Tricase Natural Park; email verified on official site
Albergo Palazzo,Albergo Palazzo,Luxury Hospitality,Santa Cesarea Terme,info@albergopalazzo.it,https://albergopalazzo.it/,Not Contacted,Historic Belle Epoque thermal spa hotel the only hotel in Salento with on-site thermal baths; email verified on official site
Antonio Conte,Independent (football manager),Public Figure Patron,Lecce (born and raised),,Represented by agent Federico Pastorello (P&P Sport Management) - no public direct contact verified,Not Contacted,Born in Lecce 1969 began career at US Lecce; frequently speaks of deep ties to his hometown; no public direct contact verified
Alessandra Amoroso,Independent (recording artist; Sony Music Italy/Epic),Public Figure Patron,Galatina (born and raised),,https://www.alessandraamoroso.it ; fanclub contact form https://fanclub.alessandraamoroso.it/site/it/contattaci/,Not Contacted,Born 1986 in Galatina Lecce province; maintains strong public ties to Salento
Tiziano Ferro,Independent (recording artist; FG Management),Public Figure Patron,Matino (LE),,https://tizianoferro.com ; managed by Fabrizio Giannini/FG Management,Not Contacted,Purchased a historic palazzo in Piazza San Giorgio Matino in the Salento countryside as a recurring residence
Meryl Streep,Independent (actress),Public Figure Patron,Tricase (Mito area),,Agent Franklin Latt / Creative Artists Agency (info@caa.com),Not Contacted,Purchased a home in the Mito area of Tricase Porto within the Costa di Otranto-Santa Maria di Leuca natural park widely reported since 2016-17
Francis Ford Coppola,Independent (director/producer; American Zoetrope),Public Figure Patron,Ugento (LE),,https://www.zoetrope.com (no direct press email verified),Not Contacted,Purchased a masseria in Ugento after genealogical research traced his family's pre-1700s roots to Ugento and San Cesario di Lecce; a documented ancestral return not just a vacation-home purchase
Alberto Paglialunga,Deghi S.p.A.,Public Figure Patron,Novoli / San Cesario di Lecce (LE),info@deghishop.it,https://www.deghishop.it,Not Contacted,Founder and CEO of Deghi a major Salento-headquartered e-commerce company with 260+ employees and strong regional public profile
Mario Schirinzi,Azienda Olearia Schirinzi (Frantoio Schirinzi),Olive Oil Producer,Carmiano (LE),,https://www.schirinzi.it/contatti/,Not Contacted,Family-run mill since 1963 three generations around 40 hectares of groves near the Salento coast; email cited only by third-party directories not confirmed on official site so left blank
Giuseppe Agrosì,Azienda Agricola Agrosì,Olive Oil Producer,Supersano (LE),info@agrosi.it,https://olioagrosi.com/,Not Contacted,Organic ICEA-certified cold-extraction EVOO; family growing olives 200+ years; recently planted 5000 Xylella-tolerant Leccino trees over 20 hectares regeneration-relevant
Famiglia Congedi,Frantoio Congedi,Olive Oil Producer,Ugento (LE),info@frantoiocongedi.com,https://frantoiocongedi.com/it/contatti/,Not Contacted,Historic mill founded 1917 one of Salento's larger production facilities; email verified via official contact page
Donna Oleria,Donna Oleria,Olive Oil Producer,Monteroni di Lecce (LE),shop@donnaoleria.it,https://www.donnaoleria.it/,Not Contacted,Premium producer of DOP Terra d'Otranto EVOO; email verified on official site
Paolo Benegiamo,L'Astore Masseria,Olive Oil Producer,Cutrofiano (LE),info@lastoremasseria.it,https://www.lastoremasseria.it/,Not Contacted,Historic family estate since 1935 around 80 hectares of vineyards olive groves and arable land with an 18th-century underground mill; major independent landowner
Giovanni Melcarne,Melcarne Forestaforte,Olive Oil Producer,Gagliano del Capo (LE),info@forestaforte.it,https://forestaforte.com/olio-del-salento/,Not Contacted,Historic olive-growing family documented locally since the 1580s; family member created an award-winning spreadable EVOO product explicitly framed as reviving territory devastated by Xylella
Famiglia Marangelli,Menhir Marangelli (Cantine Menhir Salento),Wine Producer,Bagnolo del Salento (LE),commerciale@menhirsalento.com,https://www.menhirsalento.com/,Not Contacted,Family-founded 2000 by Gaetano and Vito Angelo Marangelli rebranded in 2025; email verified on official site
