Name,Organisation,Category,Location,Email,Alternative Contact,Status,Notes
Famiglia Guagnano,Feudi di Guagnano,Wine Producer,Guagnano (LE),sales@feudiguagnano.it,https://www.feudiguagnano.it/en/our-company/,Not Contacted,Founded 2002 by three cousins reviving family and village Negroamaro vineyards; email verified on official site
Famiglia Zonin,Masseria Altemura (Gruppo Zonin1821),Wine Producer,Torre Santa Susanna / Oria (BR),info@masseriaaltemura.it,https://www.masseriaaltemura.it/en/,Not Contacted,Premium Primitivo di Manduria and Salento estate owned since 2000 by the Veneto-based Zonin wine dynasty not a native Salento family; email verified via multiple sources
Famiglia Leuci,Cantine Leuci (Leuci Lucio S.a.s.),Wine Producer,Salice Salentino (LE),amministrazione@vinileuci.it,https://www.salentowineshop.com/en/wineries/lucioleuci-en/,Not Contacted,Family winery since 1924 now run by grandson Francesco Leuci; email found via secondary listing not directly fetched from own domain medium-high confidence
Famiglia Serio,Cantine Serio (Azienda Vitivinicola Giuseppe Serio),Wine Producer,San Donaci (BR),info@cantineserio.com,https://cantineserio.com/,Not Contacted,Family winery since the 1930s four generations in the Salice Salentino DOC area; email verified on official site
Famiglia Fatano,Interfrutta / Fatano 1880 Group,Entrepreneurial Family,Lecce,,https://www.fatano.it/?p=contatti,Not Contacted,Historic family-owned agri-food distribution group over 90 years old; no official email published only phone fax and contact form; CEO Roberto Fatano died May 2026 leadership in transition
Dolcenera,K6DN Management (Apollo Records),Public Figure Patron,Galatina / Scorrano (LE),info@dolcenera.it,Booking: Baobab Music massimo.levantini@baobabmusic.it,Not Contacted,Born Galatina 1977 raised in Scorrano; widely called la leonessa del Salento; email verified on official site
Après La Classe,Molly Arts Live,Public Figure Patron,Aradeo (LE),info@mollyartslive.it,https://apreslaclasse.org,Not Contacted,Ska reggae patchanka band formed 1996 in Aradeo still active; booking contact confirmed via press coverage
Flavia Pennetta,Independent (former tennis player),Public Figure Patron,Brindisi (BR) - Salento area,,https://flaviapennetta.eu (contact form),Not Contacted,Born Brindisi 1982; married in Ostuni Cathedral donated tennis courts to Brindisi spends part of year in the region; no verified direct email found
Graziano Pellè,U.S. Lecce,Public Figure Patron,San Cesario di Lecce / Monteroni di Lecce (LE),stampa@uslecce.it,https://www.uslecce.it,Not Contacted,Born San Cesario di Lecce raised in Monteroni di Lecce came through Lecce's youth academy; currently works for U.S. Lecce per 2025 reporting; contacted via club press office
Paolo Leo,Cantine Paololeo Srl,Wine Producer,San Donaci (BR) - Salento wine district,info@paololeo.it,https://www.paololeo.it/contatti,Not Contacted,Founded 1989 family winery in the Parco del Negroamaro; San Donaci is in Brindisi province not Lecce though within the wider Salento wine district
Mocavero,Azienda Vinicola Mocavero,Wine Producer,Arnesano (LE),info@mocaverovini.it,https://www.mocaverovini.it/chi-siamo.html,Not Contacted,Family winery since 1950 third generation Primitivo and Negroamaro focus; confirmed genuine winery in Lecce province
Palazzo Sant'Anna Lecce,Palazzo Sant'Anna Lecce,Luxury Hospitality,Lecce (historic centre),info@palazzosantannalecce.com,https://www.psalecce.com/contatti/,Not Contacted,Historic Baroque-era residence and luxury suites in Lecce old town
Masseria Trapana,Masseria Trapana,Luxury Hospitality,Lecce (rural outskirts),info@trapana.com,https://www.trapana.com/en/,Not Contacted,16th-century restored masseria and olive estate near Lecce
Nohasi Palace Hotel & Spa,Nohasi Palace,Luxury Hospitality,Noha Galatina (LE),info@nohasipalace.com,https://www.nohasipalace.com/en/,Not Contacted,Historic noble residence and hotel with medieval tower
Palazzo Zimara Boutique Hotel,Palazzo Zimara Boutique Hotel - The D'Angelo Family Collection,Luxury Hospitality,Lecce (historic centre),info@palazzozimara.it,https://palazzozimara.it/contact/,Not Contacted,16th-century palazzo D'Angelo family-owned
Masseria Corsano,Masseria Corsano,Luxury Hospitality,Nardò (LE),info@masseriacorsano.com,https://www.masseriacorsano.com,Not Contacted,15-suite luxury boutique masseria
Tenuta Centoporte,Tenuta Centoporte,Luxury Hospitality,Giurdignano (LE),info@tenutacentoporte.it,https://tenutacentoporte.it/contatti/,Not Contacted,Resort near Otranto; also lists direzione@ and reservations@ addresses
Masseria Panareo,Masseria Panareo,Luxury Hospitality,Otranto,info@masseriapanareo.com,https://www.masseriapanareo.com/en/contact/,Not Contacted,Medieval-origin masseria near Porto Badisco; email confirmed via domain search not directly visible on fetched page medium-high confidence
Masseria Bandino & Spa,Masseria Bandino & Spa,Luxury Hospitality,Otranto,reception@masseriabandino.it,https://masseriabandino.it/en/,Not Contacted,Family-run masseria hotel restaurant and spa
Masseria dei Monaci,Masseria dei Monaci (BRRS Vacanze Srl),Luxury Hospitality,Otranto,info@masseriadeimonaci.com,https://masseriadeimonaci.com/en/,Not Contacted,Historic masseria linked to the Abbey of San Nicola di Casole
Palazzo Ducale Venturi,Palazzo Ducale Venturi,Luxury Hospitality,Minervino di Lecce (LE),info@palazzoducaleventuri.com,https://www.palazzoducaleventuri.com/en/index,Not Contacted,16th-century aristocratic palace turned 5-star hotel and spa part of Ermes Hotels Collection
Borgo Mulino a Vento,D'Alba Sas di Carluccio Maria,Luxury Hospitality,Uggiano La Chiesa (LE),info@mulinoavento.it,https://www.mulinoavento.it,Not Contacted,4-star country resort near Otranto
Furnirussi Tenuta,Furnirussi Tenuta,Luxury Hospitality,Serrano di Carpignano Salentino (LE),info@furnirussi.com,https://www.furnirussi.com/en,Not Contacted,5-star design resort in an organic fig orchard; email corroborated by multiple sources direct fetch blocked by certificate error medium-high confidence
Torre Assunta Hotel,Hotel Torre Assunta,Luxury Hospitality,Gallipoli (LE),info@hoteltorreassunta.com,https://www.hoteltorreassunta.com,Not Contacted,5-star hotel near Gallipoli distinct from the similarly named Masseria Torre Assunta
Tenuta Negroamaro,Hotel Tenuta Negroamaro,Luxury Hospitality,Sannicola (LE),reservations@tenutanegroamaro.com,https://www.tenutanegroamaro.com/contact/,Not Contacted,Boutique estate hotel around 4 kilometres from Gallipoli
Masseria Li Foggi,Masseria Li Foggi Resort,Luxury Hospitality,Gallipoli (LE),booking@masserialifoggiresort.it,https://www.masserialifoggiresort.it/en/contacts-vacances-gallipoli/,Not Contacted,16th-century masseria resort managed under the AUS and MESON brand
Vivosa Apulia Resort,Vivosa Apulia Resort,Luxury Hospitality,Marina di Ugento (LE),info@vivosaresort.com,https://www.vivosaresort.com,Not Contacted,Large eco-resort on the Ionian coast
Castello di Ugento,Castello di Ugento,Luxury Hospitality,Ugento (LE),reservations@castellodiugento.com,https://www.castellodiugento.com,Not Contacted,5-star historic-monument hotel ancestral seat of the d'Amore family for four centuries
Masseria Li Sauli,Antica Masseria Li Sauli,Luxury Hospitality,Gallipoli (LE),booking@lisauli.it,https://lisauli.it,Not Contacted,19th-century farmhouse resort near Gallipoli and Baia Verde
Caroli Hotels,Caroli Group,Luxury Hospitality,Gallipoli / Santa Maria di Leuca (LE),booking@carolihotels.it,https://www.carolihotels.com/hotels/,Not Contacted,Salento's oldest hotel network est. 1966 founded by Attilio Caroli; group contact given flagship property Ecoresort Le Sirenè Gallipoli
CDSHotels - Corte di Nettuno,CDSHotels S.p.A.,Luxury Hospitality,Otranto,info@cdshotels.it,https://cdshotels.it/en/corte-di-nettuno-en/,Not Contacted,4-star boutique maritime-themed hotel in historic Otranto part of the CDSHotels portfolio distinct from three already-listed CDS properties
